{
  "schema_version": 1,
  "matrix_version": "strict_matrix_v1",
  "stage": 3,
  "validation_scope": "synthetic_numeric",
  "real_data_status": "not_configured",
  "expanded_case_id_format": "{case_id}_{seed_role}_{seed}",
  "cases": [
    {
      "case_id": "stage3_basic_int32_int8_bias_time",
      "tier": "basic",
      "backend": "cpu_int32_reference",
      "execution_model": "cpu_int32",
      "carrier": "int32",
      "shape_profile": "cpu_basic",
      "shape": [8, 4, 16, 32],
      "state_profile": "omitted",
      "bias_profile": "enabled_random",
      "layout_profile": "time_major",
      "batch_first": false,
      "math_mode": "not_applicable",
      "data_seeds": {"calibration": [0], "evaluation": [0], "calibration_equals_evaluation": true},
      "parameter_seed": 3001,
      "parameter_source": "pytorch_typical_v1",
      "bitwidth_profile": "all_int8",
      "threshold_profile": "int8",
      "activation_profile": "domain_default",
      "activation_probe": "input",
      "parameter_granularities": {"weight_ih": "per_channel", "weight_hh": "per_channel", "bias_ih": "per_channel", "bias_hh": "per_channel"},
      "directed_profiles": [],
      "resolved_quant_config": {
        "schema_version": 1,
        "scale_mode": "affine",
        "operators": {
          "input": {"bitwidth": 8, "is_unsigned": false, "is_symmetric": true},
          "output": {"bitwidth": 8, "is_unsigned": false, "is_symmetric": true},
          "cell_state": {"bitwidth": 8, "is_unsigned": false, "is_symmetric": true},
          "weight_ih": {"bitwidth": 8, "granularity": "per_channel"},
          "weight_hh": {"bitwidth": 8, "granularity": "per_channel"},
          "bias_ih": {"bitwidth": 8, "granularity": "per_channel"},
          "bias_hh": {"bitwidth": 8, "granularity": "per_channel"},
          "weight_ih_linear": {"bitwidth": 8, "is_unsigned": false, "is_symmetric": true},
          "weight_hh_linear": {"bitwidth": 8, "is_unsigned": false, "is_symmetric": true},
          "input_gate_input": {"bitwidth": 8, "is_unsigned": false, "is_symmetric": true},
          "forget_gate_input": {"bitwidth": 8, "is_unsigned": false, "is_symmetric": true},
          "cell_gate_input": {"bitwidth": 8, "is_unsigned": false, "is_symmetric": true},
          "output_gate_input": {"bitwidth": 8, "is_unsigned": false, "is_symmetric": true},
          "input_gate_output": {"bitwidth": 8, "is_unsigned": true, "is_symmetric": true},
          "forget_gate_output": {"bitwidth": 8, "is_unsigned": true, "is_symmetric": true},
          "cell_gate_output": {"bitwidth": 8, "is_unsigned": false, "is_symmetric": true},
          "output_gate_output": {"bitwidth": 8, "is_unsigned": true, "is_symmetric": true},
          "cell_tanh_output": {"bitwidth": 8, "is_unsigned": false, "is_symmetric": true}
        }
      }
    },
    {
      "case_id": "stage3_basic_fp32_int16_bias_batch",
      "tier": "basic",
      "backend": "cpu_fp32_reference",
      "execution_model": "cpu_fp32",
      "carrier": "float32_quantized_values",
      "shape_profile": "cpu_basic",
      "shape": [8, 4, 16, 32],
      "state_profile": "explicit_zero",
      "bias_profile": "enabled_random",
      "layout_profile": "batch_major",
      "batch_first": true,
      "math_mode": "not_applicable",
      "data_seeds": {"calibration": [0], "evaluation": [0], "calibration_equals_evaluation": true},
      "parameter_seed": 3001,
      "parameter_source": "pytorch_typical_v1",
      "bitwidth_profile": "all_int16",
      "threshold_profile": "int16",
      "activation_profile": "domain_default",
      "activation_probe": "input",
      "parameter_granularities": {"weight_ih": "per_channel", "weight_hh": "per_channel", "bias_ih": "per_channel", "bias_hh": "per_channel"},
      "directed_profiles": [],
      "resolved_quant_config": {
        "schema_version": 1,
        "scale_mode": "affine",
        "operators": {
          "input": {"bitwidth": 16, "is_unsigned": false, "is_symmetric": true},
          "output": {"bitwidth": 16, "is_unsigned": false, "is_symmetric": true},
          "cell_state": {"bitwidth": 16, "is_unsigned": false, "is_symmetric": true},
          "weight_ih": {"bitwidth": 16, "granularity": "per_channel"},
          "weight_hh": {"bitwidth": 16, "granularity": "per_channel"},
          "bias_ih": {"bitwidth": 16, "granularity": "per_channel"},
          "bias_hh": {"bitwidth": 16, "granularity": "per_channel"},
          "weight_ih_linear": {"bitwidth": 16, "is_unsigned": false, "is_symmetric": true},
          "weight_hh_linear": {"bitwidth": 16, "is_unsigned": false, "is_symmetric": true},
          "input_gate_input": {"bitwidth": 16, "is_unsigned": false, "is_symmetric": true},
          "forget_gate_input": {"bitwidth": 16, "is_unsigned": false, "is_symmetric": true},
          "cell_gate_input": {"bitwidth": 16, "is_unsigned": false, "is_symmetric": true},
          "output_gate_input": {"bitwidth": 16, "is_unsigned": false, "is_symmetric": true},
          "input_gate_output": {"bitwidth": 16, "is_unsigned": true, "is_symmetric": true},
          "forget_gate_output": {"bitwidth": 16, "is_unsigned": true, "is_symmetric": true},
          "cell_gate_output": {"bitwidth": 16, "is_unsigned": false, "is_symmetric": true},
          "output_gate_output": {"bitwidth": 16, "is_unsigned": true, "is_symmetric": true},
          "cell_tanh_output": {"bitwidth": 16, "is_unsigned": false, "is_symmetric": true}
        }
      }
    },
    {
      "case_id": "stage3_basic_int32_mixed_no_bias_batch",
      "tier": "basic",
      "backend": "cpu_int32_reference",
      "execution_model": "cpu_int32",
      "carrier": "int32",
      "shape_profile": "cpu_basic",
      "shape": [8, 4, 16, 32],
      "state_profile": "typical_random",
      "bias_profile": "disabled",
      "layout_profile": "batch_major",
      "batch_first": true,
      "math_mode": "not_applicable",
      "data_seeds": {"calibration": [0], "evaluation": [0], "calibration_equals_evaluation": true},
      "parameter_seed": 3001,
      "parameter_source": "pytorch_typical_v1",
      "bitwidth_profile": "mixed_8_16",
      "threshold_profile": "int8",
      "activation_profile": "domain_default",
      "activation_probe": "input",
      "parameter_granularities": {"weight_ih": "per_channel", "weight_hh": "per_channel", "bias_ih": "not_applicable", "bias_hh": "not_applicable"},
      "directed_profiles": [],
      "resolved_quant_config": {
        "schema_version": 1,
        "scale_mode": "affine",
        "operators": {
          "input": {"bitwidth": 8, "is_unsigned": false, "is_symmetric": true},
          "output": {"bitwidth": 16, "is_unsigned": false, "is_symmetric": true},
          "cell_state": {"bitwidth": 8, "is_unsigned": false, "is_symmetric": true},
          "weight_ih": {"bitwidth": 16, "granularity": "per_channel"},
          "weight_hh": {"bitwidth": 8, "granularity": "per_channel"},
          "bias_ih": {"bitwidth": 16, "granularity": "per_channel"},
          "bias_hh": {"bitwidth": 8, "granularity": "per_channel"},
          "weight_ih_linear": {"bitwidth": 16, "is_unsigned": false, "is_symmetric": true},
          "weight_hh_linear": {"bitwidth": 8, "is_unsigned": false, "is_symmetric": true},
          "input_gate_input": {"bitwidth": 16, "is_unsigned": false, "is_symmetric": true},
          "forget_gate_input": {"bitwidth": 8, "is_unsigned": false, "is_symmetric": true},
          "cell_gate_input": {"bitwidth": 16, "is_unsigned": false, "is_symmetric": true},
          "output_gate_input": {"bitwidth": 8, "is_unsigned": false, "is_symmetric": true},
          "input_gate_output": {"bitwidth": 16, "is_unsigned": true, "is_symmetric": true},
          "forget_gate_output": {"bitwidth": 8, "is_unsigned": true, "is_symmetric": true},
          "cell_gate_output": {"bitwidth": 16, "is_unsigned": false, "is_symmetric": true},
          "output_gate_output": {"bitwidth": 8, "is_unsigned": true, "is_symmetric": true},
          "cell_tanh_output": {"bitwidth": 16, "is_unsigned": false, "is_symmetric": true}
        }
      }
    },
    {
      "case_id": "stage3_basic_fp32_int8_no_bias_time",
      "tier": "basic",
      "backend": "cpu_fp32_reference",
      "execution_model": "cpu_fp32",
      "carrier": "float32_quantized_values",
      "shape_profile": "cpu_basic",
      "shape": [8, 4, 16, 32],
      "state_profile": "near_quant_boundary",
      "bias_profile": "disabled",
      "layout_profile": "time_major",
      "batch_first": false,
      "math_mode": "not_applicable",
      "data_seeds": {"calibration": [0], "evaluation": [0], "calibration_equals_evaluation": true},
      "parameter_seed": 3001,
      "parameter_source": "pytorch_typical_v1",
      "bitwidth_profile": "all_int8",
      "threshold_profile": "int8",
      "activation_profile": "domain_default",
      "activation_probe": "input",
      "parameter_granularities": {"weight_ih": "per_channel", "weight_hh": "per_channel", "bias_ih": "not_applicable", "bias_hh": "not_applicable"},
      "directed_profiles": [],
      "resolved_quant_config": {
        "schema_version": 1,
        "scale_mode": "affine",
        "operators": {
          "input": {"bitwidth": 8, "is_unsigned": false, "is_symmetric": true},
          "output": {"bitwidth": 8, "is_unsigned": false, "is_symmetric": true},
          "cell_state": {"bitwidth": 8, "is_unsigned": false, "is_symmetric": true},
          "weight_ih": {"bitwidth": 8, "granularity": "per_channel"},
          "weight_hh": {"bitwidth": 8, "granularity": "per_channel"},
          "bias_ih": {"bitwidth": 8, "granularity": "per_channel"},
          "bias_hh": {"bitwidth": 8, "granularity": "per_channel"},
          "weight_ih_linear": {"bitwidth": 8, "is_unsigned": false, "is_symmetric": true},
          "weight_hh_linear": {"bitwidth": 8, "is_unsigned": false, "is_symmetric": true},
          "input_gate_input": {"bitwidth": 8, "is_unsigned": false, "is_symmetric": true},